{
  "id": "backend/canonical_module_shape",
  "surface": "backend",
  "title": "Every wired ``modules/<name>`` dir carries ``models`` / ``schemas`` / ``service`` / ``router`` / ``module``",
  "intent": "Terp modules are uniform on purpose: the table lives in ``models``, the DTOs in ``schemas``, the logic in ``service``, the routes in ``router``, and the manifest in ``module`` \u2014 so the shape is predictable to discover and the other rules (response models, input caps, audited writes, the declared ``Policy``) have the surface they scan. A directory under ``modules/`` is treated as a module once it ships a manifest (``module.py``) **or** a mounted ``router.py``; it must then carry **all** of the canonical files, and the rule names each missing one. Including ``module.py`` in the required set is deliberate: a dir that ships a router with no manifest would otherwise be invisible to this rule *and* to ``modules_declare_policy`` (which only scans ``module.py``), so it could mount a router with no declared Policy unnoticed. A dir with neither signal (a partial or a shared-asset / helper dir) is left alone.",
  "layer": "static-bespoke",
  "enforcement": [
    {
      "kind": "build-time",
      "tool": "terp.arch",
      "ref": "check_canonical_module_shape"
    }
  ],
  "opt_out": "# arch-allow-canonical-module-shape: <reason>",
  "runtime": {
    "applicability": "not-applicable",
    "rationale": "Repository-layout governance: the module directory's file shape exists only in the source tree. Composition consumes the ModuleSpec object, which carries no memory of which files declared it, so no runtime seam can observe the layout."
  },
  "guide_topic": "module",
  "corpus": true
}
