{
  "id": "backend/no_dependency_overrides",
  "surface": "backend",
  "title": "App code never rebinds the composed app's dependency injections",
  "intent": "Composition binds the authentication and session seams once. Rebinding the app's dependency-override map in app code (e.g. replacing the principal provider) silently disables authentication or swaps the database session outside every guard. Overrides are a TEST-ONLY seam; application code has no legitimate use.",
  "layer": "static-portable",
  "enforcement": [
    {
      "kind": "build-time",
      "tool": "terp.arch",
      "ref": "check_no_dependency_overrides"
    },
    {
      "kind": "runtime",
      "tool": "terp.core",
      "ref": "freeze_dependency_overrides"
    }
  ],
  "reference": "app.dependency_overrides on the create_app-composed app is the refused surface; composition binds the seams (create_app(principal_provider=...)) before the freeze.",
  "opt_out": "# arch-allow-no-dependency-overrides: <reason>",
  "runtime": {
    "applicability": "required",
    "rationale": "Outside the local environment the composed app's dependency-override map is replaced by a refusing mapping: every mutating spelling raises a BootError naming this rule while per-request override reads keep working. The local environment deliberately keeps the map writable -- overrides are the sanctioned test-only seam (a local test suite rebinding the session against a scratch engine), which is exactly the legitimate use the rule's intent carves out; a deployed app can never rebind its auth or session seams post-composition."
  },
  "guide_topic": "capability",
  "corpus": true
}
