{
  "id": "backend/input_schemas_exclude_managed_columns",
  "surface": "backend",
  "title": "No input schema declares a framework-managed column",
  "intent": "An input schema is a *Create / *Update or any class used as a request body (a route handler's body parameter, or a generated CRUD router's create/update schema) — the same role-based definition the input-cap rule uses, so an off-convention DTO (UserProvision, LoginRequest) is covered too. The write chokepoint copies a schema's fields onto the model, so a client-settable id / version / tenant_id / created_by_id is an over-posting (mass-assignment) hole — a client could forge the primary key, defeat optimistic concurrency, or cross a tenant boundary. The framework assigns every managed column centrally; an input schema must never expose one. (The write chokepoint also strips the same set at runtime — this rule is the build-time half of that two-layer control.)",
  "layer": "static-bespoke",
  "enforcement": [
    {
      "kind": "build-time",
      "tool": "terp.arch",
      "ref": "check_input_schemas_exclude_managed_columns"
    },
    {
      "kind": "runtime",
      "tool": "terp.core",
      "ref": "BaseService"
    }
  ],
  "reference": "BaseService.create/update strip the managed set via _without_managed_columns; build_crud_router create/update schemas are scanned too.",
  "opt_out": "# arch-allow-input-schemas-exclude-managed-columns: <reason>",
  "runtime": {
    "applicability": "required",
    "rationale": "BaseService.create/update strip every framework-managed column from the inbound payload at the write chokepoint (_without_managed_columns), so even an over-wide schema that ships cannot mass-assign id / version / scope / actor columns."
  },
  "guide_topic": "module",
  "corpus": true
}
